{
  "$schema": "https://json-schema.org/draft/2020-12/schema",
  "$id": "mimo-protocol.schema.json",
  "title": "MiMo Code wire vocabulary",
  "description": "Each table maps PascalCase identifiers to protocol values. Go constants and TypeScript keys derive from those identifiers. Every table requires at least one value. An empty table supplies no dispatch case and prevents the generator from checking coverage. Subset arrays select keys from their parent contract tables.",
  "type": "object",
  "additionalProperties": false,
  "required": [
    "_readme",
    "events",
    "statusTypes",
    "errorNames",
    "partTypes",
    "toolStatuses",
    "toolNames",
    "actorActions",
    "actorStatuses",
    "actorOutcomes",
    "taskActions",
    "taskStatuses",
    "modes",
    "defaultMode",
    "options",
    "permissionPolicies",
    "permissionReplies",
    "controlFields",
    "audioMimeTypes"
  ],
  "$defs": {
    "table": {
      "type": "object",
      "minProperties": 1,
      "propertyNames": {
        "pattern": "^[A-Z][A-Za-z0-9]*$"
      },
      "additionalProperties": {
        "type": "string",
        "minLength": 1
      }
    },
    "unread": {
      "description": "This map states per-key reader exemptions. contractsAreConsumed.test.mjs checks each key on every declared reader side. A key that one side does not consume must state its reason here.",
      "type": "object",
      "minProperties": 1,
      "additionalProperties": {
        "type": "object",
        "minProperties": 1,
        "propertyNames": {
          "pattern": "^[A-Z][A-Za-z0-9]*$"
        },
        "additionalProperties": {
          "type": "object",
          "additionalProperties": false,
          "required": [
            "sides",
            "why"
          ],
          "properties": {
            "sides": {
              "type": "array",
              "minItems": 1,
              "uniqueItems": true,
              "items": {
                "enum": [
                  "go",
                  "ts"
                ]
              }
            },
            "why": {
              "type": "string",
              "minLength": 31
            }
          }
        }
      }
    },
    "structs": {
      "description": "The generator creates Go structs from this domain. Each struct declares its fields once and takes every JSON tag from a specified table. A table rename therefore reaches the struct.",
      "type": "object",
      "minProperties": 1,
      "propertyNames": {
        "pattern": "^[A-Z][A-Za-z0-9]*$"
      },
      "additionalProperties": {
        "type": "object",
        "additionalProperties": false,
        "required": [
          "table",
          "fields"
        ],
        "properties": {
          "doc": {
            "type": "string",
            "minLength": 1
          },
          "table": {
            "type": "string",
            "minLength": 1
          },
          "fields": {
            "type": "array",
            "minItems": 1,
            "items": {
              "type": "object",
              "additionalProperties": false,
              "required": [
                "key",
                "type"
              ],
              "properties": {
                "key": {
                  "type": "string",
                  "pattern": "^[A-Z][A-Za-z0-9]*$"
                },
                "type": {
                  "type": "string",
                  "minLength": 1
                },
                "omitempty": {
                  "type": "boolean"
                },
                "table": {
                  "type": "string",
                  "minLength": 1
                }
              }
            }
          }
        }
      }
    }
  },
  "properties": {
    "_readme": {
      "type": "string",
      "minLength": 1
    },
    "_unread": {
      "$ref": "#/$defs/unread"
    },
    "events": {
      "$ref": "#/$defs/table"
    },
    "statusTypes": {
      "$ref": "#/$defs/table"
    },
    "errorNames": {
      "$ref": "#/$defs/table"
    },
    "partTypes": {
      "$ref": "#/$defs/table"
    },
    "toolStatuses": {
      "$ref": "#/$defs/table"
    },
    "toolNames": {
      "$ref": "#/$defs/table"
    },
    "actorActions": {
      "$ref": "#/$defs/table"
    },
    "actorStatuses": {
      "$ref": "#/$defs/table"
    },
    "actorOutcomes": {
      "$ref": "#/$defs/table"
    },
    "taskActions": {
      "$ref": "#/$defs/table"
    },
    "taskStatuses": {
      "$ref": "#/$defs/table"
    },
    "modes": {
      "$ref": "#/$defs/table"
    },
    "defaultMode": {
      "description": "This key selects a value in `modes` for a new MiMo session. The generator checks that the table contains the key.",
      "type": "string",
      "pattern": "^[A-Z][A-Za-z0-9]*$"
    },
    "options": {
      "$ref": "#/$defs/table"
    },
    "permissionPolicies": {
      "$ref": "#/$defs/table"
    },
    "permissionReplies": {
      "$ref": "#/$defs/table"
    },
    "controlFields": {
      "$ref": "#/$defs/table"
    },
    "audioMimeTypes": {
      "type": "array",
      "minItems": 1,
      "uniqueItems": true,
      "items": {
        "type": "string",
        "pattern": "^[A-Z][A-Za-z0-9]*$"
      }
    }
  }
}
